company,industry,website,phone,contact,location,summary,ai_opportunities,status,date_added,date_contacted,notes
Klinidoc,Medical Practice,https://klinidoc.co.za/,041 450 8808,mpadmin@klinidoc.co.za,"95 Cape Road, Mill Park, Gqeberha (plus Cotswold and Newton Park branches)","Multi-branch general practice (Mill Park, Cotswold, Newton Park), open Mon-Sat.","AI WhatsApp assistant for bookings/FAQs across 3 branches; missed-call text-back; automated appointment reminders; cross-branch enquiry routing",researched,2026-07-10,,Verified email and phone via web search
Greenways Family Medical Centre,Medical Practice,https://www.greenwaysmedical.co.za/,041 368 3706,info@greenwaysmedical.co.za,"4 Greenways Avenue, Lovemore Heights, Port Elizabeth","Family medical centre with attached pharmacy, psychology services, and a travel clinic.","WhatsApp assistant to triage enquiries across medical/pharmacy/psychology/travel lines; automated prescription refill reminders; missed-call text-back",researched,2026-07-10,,Verified general email and phone via web search
Famhealth Medipark,Medical Practice,https://famhealthmedipark.com/,041 457 2075,,"131 Springbok Street, Gelvandale, Gqeberha","GP practice plus home-based caregiver training programme (4000+ graduates since 2010).","WhatsApp booking/reminder assistant (no email listed, phone-first); missed-call text-back; automated chronic medication authorisation follow-ups",researched,2026-07-10,,No public email found - use phone/WhatsApp or website contact
McWilliams & Elliott,Law Firm,https://www.mcwilliams.co.za/,+27 41 582 1250,law@mcwilliams.co.za,"152 Cape Road, Mill Park, Gqeberha","Port Elizabeth's oldest law firm (est. 1853); wide practice areas incl. conveyancing, family law, labour, litigation, immigration, RAF claims.","AI chatbot to triage enquiries to the right practice area; lead capture from website into CRM; automated status-update follow-ups for conveyancing/RAF clients; consultation booking automation",researched,2026-07-10,,Verified general email and phone via web search
J.R Bester & Associates,Law Firm,https://www.bestlaw.co.za/,,,Gqeberha (address not publicly confirmed),"Boutique law firm est. 1996; conveyancing, notarial work, debt review, deceased estates, wills, family and commercial law.","Website/WhatsApp chatbot for initial enquiry qualification (wills/estates/conveyancing); automated matter-status follow-ups; missed-call text-back for a small team",researched,2026-07-10,,No public phone/email found - use website contact form
Affinity Real Estate,Property Agency,https://www.affinityrealestate.co.za/,041 373 3283,,"20 Nile Road, Perridgevale, Port Elizabeth","Independent boutique estate agency handling residential sales and rentals.","After-hours AI chatbot for property enquiries; automated lead capture/qualification from Property24 & Private Property into CRM; viewing booking automation; automated post-viewing follow-ups",researched,2026-07-10,,No general email confirmed (only personal-name pattern found) - use phone or website contact form
Warren Jack Property Group,Property Agency,https://www.warrenjack.co.za/,041 365 6200,,"74 Cape Road, Mill Park, Port Elizabeth","Established local agency with a multi-agent team covering most PE/Gqeberha suburbs.","Central AI chatbot routing enquiries to the right agent by suburb; CRM integration across multiple agents; automated viewing scheduling; missed-call text-back for high enquiry volume",researched,2026-07-10,,No general email confirmed - use website contact form
